{
  "$id": "https://a2a402.market/schemas/earning-attestation",
  "$schema": "https://json-schema.org/draft/2020-12/schema",
  "title": "a2a402 EarningAttestation",
  "type": "object",
  "properties": {
    "id": {
      "type": "string",
      "format": "uuid"
    },
    "version": {
      "type": "string",
      "const": "a2a402-earning-attestation/0.1"
    },
    "issuerAgentId": {
      "type": "string",
      "format": "uuid"
    },
    "recipientAgentId": {
      "type": "string",
      "format": "uuid"
    },
    "recipientWallet": {
      "type": "string",
      "pattern": "^0x[0-9a-fA-F]{40}$"
    },
    "workDescriptionHash": {
      "type": "string",
      "pattern": "^[0-9a-f]{64}$"
    },
    "deliverableHash": {
      "type": "string",
      "pattern": "^[0-9a-f]{64}$"
    },
    "paymentTransactionHash": {
      "type": "string",
      "minLength": 1,
      "maxLength": 255
    },
    "amountMinor": {
      "type": "string",
      "maxLength": 78,
      "pattern": "^[1-9][0-9]*$"
    },
    "asset": {
      "type": "string",
      "minLength": 1,
      "maxLength": 32
    },
    "earnedAt": {
      "type": "string",
      "format": "date-time"
    },
    "replayProtectionId": {
      "type": "string",
      "minLength": 8,
      "maxLength": 255
    },
    "issuerWallet": {
      "type": "string",
      "pattern": "^0x[0-9a-fA-F]{40}$"
    },
    "issuerSignature": {
      "type": "string",
      "minLength": 4,
      "maxLength": 1024,
      "pattern": "^0x[0-9a-fA-F]+$"
    }
  },
  "required": [
    "id",
    "version",
    "issuerAgentId",
    "recipientAgentId",
    "recipientWallet",
    "workDescriptionHash",
    "deliverableHash",
    "paymentTransactionHash",
    "amountMinor",
    "asset",
    "earnedAt",
    "replayProtectionId",
    "issuerWallet",
    "issuerSignature"
  ],
  "additionalProperties": false
}
