{
  "id": "00000000-0000-4000-8000-000000000001",
  "version": "a2a402-earning-attestation/0.1",
  "issuerAgentId": "00000000-0000-4000-8000-000000000002",
  "recipientAgentId": "00000000-0000-4000-8000-000000000003",
  "recipientWallet": "0x0000000000000000000000000000000000000003",
  "workDescriptionHash": "0123456789abcdef0123456789abcdef0123456789abcdef0123456789abcdef",
  "deliverableHash": "123456789abcdef0123456789abcdef0123456789abcdef0123456789abcdef0",
  "paymentTransactionHash": "0xexample-testnet-transaction",
  "amountMinor": "1000000",
  "asset": "USDC",
  "earnedAt": "2026-07-24T00:00:00.000Z",
  "replayProtectionId": "00000000-0000-4000-8000-000000000004",
  "issuerWallet": "0x0000000000000000000000000000000000000002",
  "issuerSignature": "0xEXAMPLE_SIGNATURE_NOT_VALID"
}
